Nama : Ahmad Luthfy Alfarizzy Ammar;;;;;;;;;;;;;;;;;;;;;;;;;;Throughput :;;;;;;Time 1;Time 2;Delay;;Delay 1;Delay 2;jitter
NIM : 09011282025085;;;;;;;;;;;;;;;;;;;;;;;;;;Bytes : Time Span x 8 = 1085900 : 515.620 x 8;;;;;;0,165073;0,165073;0;;-0,291836;0,291836;0,583672
Jurusan : Sistem Komputer A;;;;;;;;;;;;;;;;;;;;;;;;;;           = 2.106 x 8;;;;;;0,165073;0,456909;0,291836;;0,291836;0;-0,291836
Mata Kuliah : Pengantar Telekomunikasi;;;;;;;;;;;;;;;;;;;;;;;;;;           = 16.848;;;;;;0,456909;0,456909;0;;-0,000203;0,000203;0,000406
Dosen Pengampu : Adi Hermansyah, S.Kom, M.T.;;;;;;;;;;;;;;;;;;;;;;;;;;           = 16 kB/s;;;;;;0,456909;0,457112;0,000203;;0,000133;7,00E-05;-0,000063
;;;;;;;;;;;;;;;;;;;;;;;;;;;;;;;;0,457112;0,457182;7,00E-05;;-0,004675;0,004745;0,00942
;;;;;;;;;;;;;;;;;;;;;;;;;;Packet Loss :;;;;;;0,457182;0,461927;0,004745;;0,004076;0,000669;-0,003407
No,;Time;Source;Destination;Protocol;Length;Info;;;;;;;;;;;;;;;;;;;;((Package Sent - Package Received) : Package Sent ) x 100%;;;;;;0,461927;0,462596;0,000669;;-0,209378;0,210047;0,419425
4;0,165073;192,168,43,111;204,79,197,200;TCP;66;58610  >  443 [SYN] Seq=0 Win=65535 Len=0 MSS=1460 WS=256 SACK_PERM=1;;;;;;;;;;;;;;;;;;;;((1848 - 1818) : 1848) x 100%;;;;;;0,462596;0,672643;0,210047;;0,210047;0;-0,210047
5;0,165073;192,168,43,111;204,79,197,200;TCP;66;58611  >  443 [SYN] Seq=0 Win=65535 Len=0 MSS=1460 WS=256 SACK_PERM=1;;;;;;;;;;;;;;;;;;;;(30 : 1848) x 100%;;;;;;0,672643;0,672643;0;;-0,000212;0,000212;0,000424
6;0,456909;204,79,197,200;192,168,43,111;TCP;66;443  >  58610 [SYN, ACK] Seq=0 Ack=1 Win=65535 Len=0 MSS=1380 WS=256 SACK_PERM=1;;;;;;;;;;;;;;;;;;;;0,01623377 x 100%;;;;;;0,672643;0,672855;0,000212;;-0,000892;0,001104;0,001996
7;0,456909;204,79,197,200;192,168,43,111;TCP;66;443  >  58611 [SYN, ACK] Seq=0 Ack=1 Win=65535 Len=0 MSS=1380 WS=256 SACK_PERM=1;;;;;;;;;;;;;;;;;;;;1,60%;;;;;;0,672855;0,673959;0,001104;;0,001104;0;-0,001104
8;0,457112;192,168,43,111;204,79,197,200;TCP;54;58610  >  443 [ACK] Seq=1 Ack=1 Win=262144 Len=0;;;;;;;;;;;;;;;;;;;;;;;;;;0,673959;0,673959;0;;0;0;0
9;0,457182;192,168,43,111;204,79,197,200;TCP;54;58611  >  443 [ACK] Seq=1 Ack=1 Win=262144 Len=0;;;;;;;;;;;;;;;;;;;;Delay :;;;;;;0,673959;0,673959;0;;-0,000244;0,000244;0,000488
10;0,461927;192,168,43,111;204,79,197,200;TLSv1,2;255;Client Hello;;;;;;;;;;;;;;;;;;;;Total Delay = 515,454687;;;;;;0,673959;0,674203;0,000244;;0,000131;0,000113;-0,000018
11;0,462596;192,168,43,111;204,79,197,200;TLSv1,2;255;Client Hello;;;;;;;;;;;;;;;;;;;;Rata Rata Delay = 0,278925696 = 278.925696 ms;;;;;;0,674203;0,674316;0,000113;;-0,71525;0,715363;1,430613
12;0,672643;204,79,197,200;192,168,43,111;TCP;54;443  >  58611 [ACK] Seq=1 Ack=202 Win=524032 Len=0;;;;;;;;;;;;;;;;;;;;;;;;;;0,674316;1,389679;0,715363;;0,715363;0;-0,715363
13;0,672643;204,79,197,200;192,168,43,111;TCP;1434;443  >  58611 [ACK] Seq=1 Ack=202 Win=524032 Len=1380 [TCP segment of a reassembled PDU];;;;;;;;;;;;;;;;;;;;Jitter :;;;;;;1,389679;1,389679;0;;-0,000148;0,000148;0,000296
14;0,672855;192,168,43,111;204,79,197,200;TCP;54;58611  >  443 [ACK] Seq=202 Ack=1381 Win=262144 Len=0;;;;;;;;;;;;;;;;;;;;Total Jitter = 515,498265;;;;;;1,389679;1,389827;0,000148;;6,00E-06;0,000142;0,000136
15;0,673959;204,79,197,200;192,168,43,111;TCP;4194;443  >  58611 [ACK] Seq=1381 Ack=202 Win=524032 Len=4140 [TCP segment of a reassembled PDU];;;;;;;;;;;;;;;;;;;;Rata Rata Jitter = 0,278949278 = 278.949278 ms;;;;;;1,389827;1,389969;0,000142;;-0,295162;0,295304;0,590466
16;0,673959;204,79,197,200;192,168,43,111;TCP;1434;443  >  58610 [ACK] Seq=1 Ack=202 Win=524032 Len=1380 [TCP segment of a reassembled PDU];;;;;;;;;;;;;;;;;;;;;;;;;;1,389969;1,685273;0,295304;;0,29517;0,000134;-0,295036
17;0,673959;204,79,197,200;192,168,43,111;TCP;2814;[TCP Previous segment not captured] 443  >  58610 [ACK] Seq=2761 Ack=202 Win=524032 Len=2760 [TCP segment of a reassembled PDU];;;;;;;;;;;;;;;;;;;;;;;;;;1,685273;1,685407;0,000134;;-0,484318;0,484452;0,96877
18;0,674203;192,168,43,111;204,79,197,200;TCP;66;58610  >  443 [ACK] Seq=202 Ack=1381 Win=262144 Len=0 SLE=2761 SRE=5521;;;;;;;;;;;;;;;;;;;;;;;;;;1,685407;2,169859;0,484452;;0,484321;0,000131;-0,48419
19;0,674316;192,168,43,111;204,79,197,200;TCP;54;58611  >  443 [ACK] Seq=202 Ack=5521 Win=262144 Len=0;;;;;;;;;;;;;;;;;;;;;;;;;;2,169859;2,16999;0,000131;;-0,467427;0,467558;0,934985
20;1,389679;204,79,197,200;192,168,43,111;TCP;1434;[TCP Previous segment not captured] 443  >  58611 [PSH, ACK] Seq=5969 Ack=202 Win=524032 Len=1380 [TCP segment of a reassembled PDU];;;;;;;;;;;;;;;;;;;;;;;;;;2,16999;2,637548;0,467558;;0,466666;0,000892;-0,465774
21;1,389679;204,79,197,200;192,168,43,111;TCP;1434;[TCP Previous segment not captured] 443  >  58610 [PSH, ACK] Seq=5969 Ack=202 Win=524032 Len=1380 [TCP segment of a reassembled PDU];;;;;;;;;;;;;;;;;;;;;;;;;;2,637548;2,63844;0,000892;;0,000799;9,30E-05;-0,000706
22;1,389827;192,168,43,111;204,79,197,200;TCP;66;[TCP Dup ACK 19#1] 58611  >  443 [ACK] Seq=202 Ack=5521 Win=262144 Len=0 SLE=5969 SRE=7349;;;;;;;;;;;;;;;;;;;;;;;;;;2,63844;2,638533;9,30E-05;;-0,005767;0,00586;0,011627
23;1,389969;192,168,43,111;204,79,197,200;TCP;74;[TCP Dup ACK 18#1] 58610  >  443 [ACK] Seq=202 Ack=1381 Win=262144 Len=0 SLE=5969 SRE=7349 SLE=2761 SRE=5521;;;;;;;;;;;;;;;;;;;;;;;;;;2,638533;2,644393;0,00586;;0,005637;0,000223;-0,005414
24;1,685273;204,79,197,200;192,168,43,111;TCP;1434;[TCP Retransmission] 443  >  58610 [ACK] Seq=1381 Ack=202 Win=524032 Len=1380;;;;;;;;;;;;;;;;;;;;;;;;;;2,644393;2,644616;0,000223;;0,000104;0,000119;0,000015
25;1,685407;192,168,43,111;204,79,197,200;TCP;66;58610  >  443 [ACK] Seq=202 Ack=5521 Win=262144 Len=0 SLE=5969 SRE=7349;;;;;;;;;;;;;;;;;;;;;;;;;;2,644616;2,644735;0,000119;;-0,175362;0,175481;0,350843
26;2,169859;204,79,197,200;192,168,43,111;TCP;1434;[TCP Retransmission] 443  >  58611 [ACK] Seq=5521 Ack=202 Win=524032 Len=1380;;;;;;;;;;;;;;;;;;;;;;;;;;2,644735;2,820216;0,175481;;0,175481;0;-0,175481
27;2,16999;192,168,43,111;204,79,197,200;TCP;66;58611  >  443 [ACK] Seq=202 Ack=7349 Win=262144 Len=0 SLE=5969 SRE=6901;;;;;;;;;;;;;;;;;;;;;;;;;;2,820216;2,820216;0;;-0,000136;0,000136;0,000272
28;2,637548;192,168,43,111;204,79,197,200;TLSv1,2;212;Client Key Exchange, Change Cipher Spec, Encrypted Handshake Message;;;;;;;;;;;;;;;;;;;;;;;;;;2,820216;2,820352;0,000136;;0,000136;0;-0,000136
29;2,63844;204,79,197,200;192,168,43,111;TCP;1434;[TCP Retransmission] 443  >  58610 [ACK] Seq=5521 Ack=202 Win=524032 Len=1380;;;;;;;;;;;;;;;;;;;;;;;;;;2,820352;2,820352;0;;0;0;0
30;2,638533;192,168,43,111;204,79,197,200;TCP;66;58610  >  443 [ACK] Seq=202 Ack=7349 Win=262144 Len=0 SLE=5969 SRE=6901;;;;;;;;;;;;;;;;;;;;;;;;;;2,820352;2,820352;0;;0;0;0
31;2,644393;192,168,43,111;204,79,197,200;TLSv1,2;212;Client Key Exchange, Change Cipher Spec, Encrypted Handshake Message;;;;;;;;;;;;;;;;;;;;;;;;;;2,820352;2,820352;0;;0;0;0
32;2,644616;192,168,43,111;204,79,197,200;TLSv1,2;141;Application Data;;;;;;;;;;;;;;;;;;;;;;;;;;2,820352;2,820352;0;;0;0;0
33;2,644735;192,168,43,111;204,79,197,200;TLSv1,2;796;Application Data;;;;;;;;;;;;;;;;;;;;;;;;;;2,820352;2,820352;0;;-0,000136;0,000136;0,000272
34;2,820216;204,79,197,200;192,168,43,111;TCP;54;443  >  58611 [ACK] Seq=7349 Ack=360 Win=524032 Len=0;;;;;;;;;;;;;;;;;;;;;;;;;;2,820352;2,820488;0,000136;;0,000078;5,80E-05;-0,00002
35;2,820216;204,79,197,200;192,168,43,111;TCP;54;443  >  58610 [ACK] Seq=7349 Ack=360 Win=524032 Len=0;;;;;;;;;;;;;;;;;;;;;;;;;;2,820488;2,820546;5,80E-05;;-0,000786;0,000844;0,00163
36;2,820352;204,79,197,200;192,168,43,111;TCP;54;443  >  58611 [ACK] Seq=7349 Ack=447 Win=523776 Len=0;;;;;;;;;;;;;;;;;;;;;;;;;;2,820546;2,82139;0,000844;;0,00078;6,40E-05;-0,000716
37;2,820352;204,79,197,200;192,168,43,111;TCP;54;443  >  58611 [ACK] Seq=7349 Ack=1189 Win=523008 Len=0;;;;;;;;;;;;;;;;;;;;;;;;;;2,82139;2,821454;6,40E-05;;0,000064;0;-0,000064
38;2,820352;204,79,197,200;192,168,43,111;TLSv1,2;380;New Session Ticket, Change Cipher Spec, Encrypted Handshake Message;;;;;;;;;;;;;;;;;;;;;;;;;;2,821454;2,821454;0;;0;0;0
39;2,820352;204,79,197,200;192,168,43,111;TLSv1,2;380;New Session Ticket, Change Cipher Spec, Encrypted Handshake Message;;;;;;;;;;;;;;;;;;;;;;;;;;2,821454;2,821454;0;;-0,00006;6,00E-05;0,00012
40;2,820352;204,79,197,200;192,168,43,111;TLSv1,2;123;Application Data;;;;;;;;;;;;;;;;;;;;;;;;;;2,821454;2,821514;6,00E-05;;-0,005728;0,005788;0,011516
41;2,820352;204,79,197,200;192,168,43,111;TLSv1,2;123;Application Data;;;;;;;;;;;;;;;;;;;;;;;;;;2,821514;2,827302;0,005788;;0,005589;0,000199;-0,00539
42;2,820488;192,168,43,111;204,79,197,200;TCP;54;58611  >  443 [ACK] Seq=1189 Ack=7744 Win=261632 Len=0;;;;;;;;;;;;;;;;;;;;;;;;;;2,827302;2,827501;0,000199;;0,000171;2,80E-05;-0,000143
43;2,820546;192,168,43,111;204,79,197,200;TCP;54;58610  >  443 [ACK] Seq=360 Ack=7744 Win=261632 Len=0;;;;;;;;;;;;;;;;;;;;;;;;;;2,827501;2,827529;2,80E-05;;-0,000232;0,00026;0,000492
44;2,82139;192,168,43,111;204,79,197,200;TLSv1,2;92;Application Data;;;;;;;;;;;;;;;;;;;;;;;;;;2,827529;2,827789;0,00026;;0,00026;0;-0,00026
45;2,821454;204,79,197,200;192,168,43,111;TLSv1,2;1434;Application Data;;;;;;;;;;;;;;;;;;;;;;;;;;2,827789;2,827789;0;;0;0;0
46;2,821454;204,79,197,200;192,168,43,111;TLSv1,2;499;Application Data;;;;;;;;;;;;;;;;;;;;;;;;;;2,827789;2,827789;0;;0;0;0
47;2,821454;204,79,197,200;192,168,43,111;TLSv1,2;92;Application Data;;;;;;;;;;;;;;;;;;;;;;;;;;2,827789;2,827789;0;;0;0;0
48;2,821514;192,168,43,111;204,79,197,200;TCP;54;58611  >  443 [ACK] Seq=1227 Ack=9607 Win=262144 Len=0;;;;;;;;;;;;;;;;;;;;;;;;;;2,827789;2,827789;0;;0;0;0
49;2,827302;192,168,43,111;204,79,197,200;TLSv1,2;141;Application Data;;;;;;;;;;;;;;;;;;;;;;;;;;2,827789;2,827789;0;;0;0;0
50;2,827501;192,168,43,111;204,79,197,200;TLSv1,2;92;Application Data;;;;;;;;;;;;;;;;;;;;;;;;;;2,827789;2,827789;0;;0;0;0
51;2,827529;192,168,43,111;204,79,197,200;TLSv1,2;964;Application Data;;;;;;;;;;;;;;;;;;;;;;;;;;2,827789;2,827789;0;;0;0;0
52;2,827789;192,168,43,111;204,79,197,200;TCP;1434;58611  >  443 [ACK] Seq=2137 Ack=9607 Win=262144 Len=1380 [TCP segment of a reassembled PDU];;;;;;;;;;;;;;;;;;;;;;;;;;2,827789;2,827789;0;;0;0;0
53;2,827789;192,168,43,111;204,79,197,200;TCP;1434;58611  >  443 [ACK] Seq=3517 Ack=9607 Win=262144 Len=1380 [TCP segment of a reassembled PDU];;;;;;;;;;;;;;;;;;;;;;;;;;2,827789;2,827789;0;;-0,092045;0,092045;0,18409
54;2,827789;192,168,43,111;204,79,197,200;TCP;1434;58611  >  443 [ACK] Seq=4897 Ack=9607 Win=262144 Len=1380 [TCP segment of a reassembled PDU];;;;;;;;;;;;;;;;;;;;;;;;;;2,827789;2,919834;0,092045;;0,091358;0,000687;-0,090671
55;2,827789;192,168,43,111;204,79,197,200;TCP;1434;58611  >  443 [ACK] Seq=6277 Ack=9607 Win=262144 Len=1380 [TCP segment of a reassembled PDU];;;;;;;;;;;;;;;;;;;;;;;;;;2,919834;2,920521;0,000687;;0,000687;0;-0,000687
56;2,827789;192,168,43,111;204,79,197,200;TCP;1434;58611  >  443 [ACK] Seq=7657 Ack=9607 Win=262144 Len=1380 [TCP segment of a reassembled PDU];;;;;;;;;;;;;;;;;;;;;;;;;;2,920521;2,920521;0;;-0,000093;9,30E-05;0,000186
57;2,827789;192,168,43,111;204,79,197,200;TCP;1434;58611  >  443 [ACK] Seq=9037 Ack=9607 Win=262144 Len=1380 [TCP segment of a reassembled PDU];;;;;;;;;;;;;;;;;;;;;;;;;;2,920521;2,920614;9,30E-05;;0,000093;0;-0,000093
58;2,827789;192,168,43,111;204,79,197,200;TCP;1434;58611  >  443 [ACK] Seq=10417 Ack=9607 Win=262144 Len=1380 [TCP segment of a reassembled PDU];;;;;;;;;;;;;;;;;;;;;;;;;;2,920614;2,920614;0;;0;0;0
59;2,827789;192,168,43,111;204,79,197,200;TCP;1434;58611  >  443 [ACK] Seq=11797 Ack=9607 Win=262144 Len=1380 [TCP segment of a reassembled PDU];;;;;;;;;;;;;;;;;;;;;;;;;;2,920614;2,920614;0;;0;0;0
60;2,827789;192,168,43,111;204,79,197,200;TCP;1434;58611  >  443 [ACK] Seq=13177 Ack=9607 Win=262144 Len=1380 [TCP segment of a reassembled PDU];;;;;;;;;;;;;;;;;;;;;;;;;;2,920614;2,920614;0;;0;0;0
61;2,827789;192,168,43,111;204,79,197,200;TCP;1434;58611  >  443 [ACK] Seq=14557 Ack=9607 Win=262144 Len=1380 [TCP segment of a reassembled PDU];;;;;;;;;;;;;;;;;;;;;;;;;;2,920614;2,920614;0;;0;0;0
62;2,919834;192,168,43,111;204,79,197,200;TCP;54;58610  >  443 [FIN, ACK] Seq=485 Ack=7744 Win=261632 Len=0;;;;;;;;;;;;;;;;;;;;;;;;;;2,920614;2,920614;0;;0;0;0
63;2,920521;204,79,197,200;192,168,43,111;TCP;54;443  >  58611 [ACK] Seq=9607 Ack=3517 Win=524288 Len=0;;;;;;;;;;;;;;;;;;;;;;;;;;2,920614;2,920614;0;;-0,000236;0,000236;0,000472
64;2,920521;204,79,197,200;192,168,43,111;TCP;54;443  >  58611 [ACK] Seq=9607 Ack=6277 Win=524288 Len=0;;;;;;;;;;;;;;;;;;;;;;;;;;2,920614;2,92085;0,000236;;0,000236;0;-0,000236
65;2,920614;192,168,43,111;204,79,197,200;TCP;1434;58611  >  443 [ACK] Seq=15937 Ack=9607 Win=262144 Len=1380 [TCP segment of a reassembled PDU];;;;;;;;;;;;;;;;;;;;;;;;;;2,92085;2,92085;0;;0;0;0
66;2,920614;192,168,43,111;204,79,197,200;TLSv1,2;1434;Application Data [TCP segment of a reassembled PDU];;;;;;;;;;;;;;;;;;;;;;;;;;2,92085;2,92085;0;;-0,000048;4,80E-05;0,000096
67;2,920614;192,168,43,111;204,79,197,200;TCP;1434;58611  >  443 [ACK] Seq=18697 Ack=9607 Win=262144 Len=1380 [TCP segment of a reassembled PDU];;;;;;;;;;;;;;;;;;;;;;;;;;2,92085;2,920898;4,80E-05;;0,000048;0;-0,000048
68;2,920614;192,168,43,111;204,79,197,200;TCP;1434;58611  >  443 [ACK] Seq=20077 Ack=9607 Win=262144 Len=1380 [TCP segment of a reassembled PDU];;;;;;;;;;;;;;;;;;;;;;;;;;2,920898;2,920898;0;;0;0;0
69;2,920614;192,168,43,111;204,79,197,200;TCP;1434;58611  >  443 [ACK] Seq=21457 Ack=9607 Win=262144 Len=1380 [TCP segment of a reassembled PDU];;;;;;;;;;;;;;;;;;;;;;;;;;2,920898;2,920898;0;;0;0;0
70;2,920614;192,168,43,111;204,79,197,200;TCP;1434;58611  >  443 [ACK] Seq=22837 Ack=9607 Win=262144 Len=1380 [TCP segment of a reassembled PDU];;;;;;;;;;;;;;;;;;;;;;;;;;2,920898;2,920898;0;;0;0;0
71;2,920614;192,168,43,111;204,79,197,200;TCP;1434;58611  >  443 [ACK] Seq=24217 Ack=9607 Win=262144 Len=1380 [TCP segment of a reassembled PDU];;;;;;;;;;;;;;;;;;;;;;;;;;2,920898;2,920898;0;;0;0;0
72;2,92085;204,79,197,200;192,168,43,111;TCP;54;443  >  58611 [ACK] Seq=9607 Ack=7657 Win=524288 Len=0;;;;;;;;;;;;;;;;;;;;;;;;;;2,920898;2,920898;0;;-0,003526;0,003526;0,007052
73;2,92085;204,79,197,200;192,168,43,111;TCP;54;443  >  58611 [ACK] Seq=9607 Ack=9037 Win=524288 Len=0;;;;;;;;;;;;;;;;;;;;;;;;;;2,920898;2,924424;0,003526;;0,003452;7,40E-05;-0,003378
74;2,92085;204,79,197,200;192,168,43,111;TCP;54;443  >  58611 [ACK] Seq=9607 Ack=10417 Win=524288 Len=0;;;;;;;;;;;;;;;;;;;;;;;;;;2,924424;2,924498;7,40E-05;;0,000074;0;-0,000074
75;2,920898;192,168,43,111;204,79,197,200;TCP;1434;58611  >  443 [ACK] Seq=25597 Ack=9607 Win=262144 Len=1380 [TCP segment of a reassembled PDU];;;;;;;;;;;;;;;;;;;;;;;;;;2,924498;2,924498;0;;-0,006942;0,006942;0,013884
76;2,920898;192,168,43,111;204,79,197,200;TCP;1434;58611  >  443 [ACK] Seq=26977 Ack=9607 Win=262144 Len=1380 [TCP segment of a reassembled PDU];;;;;;;;;;;;;;;;;;;;;;;;;;2,924498;2,93144;0,006942;;0,006858;8,40E-05;-0,006774
77;2,920898;192,168,43,111;204,79,197,200;TCP;1434;58611  >  443 [ACK] Seq=28357 Ack=9607 Win=262144 Len=1380 [TCP segment of a reassembled PDU];;;;;;;;;;;;;;;;;;;;;;;;;;2,93144;2,931524;8,40E-05;;0,000084;0;-0,000084
78;2,920898;192,168,43,111;204,79,197,200;TCP;1434;58611  >  443 [ACK] Seq=29737 Ack=9607 Win=262144 Len=1380 [TCP segment of a reassembled PDU];;;;;;;;;;;;;;;;;;;;;;;;;;2,931524;2,931524;0;;0;0;0
79;2,920898;192,168,43,111;204,79,197,200;TCP;1434;58611  >  443 [ACK] Seq=31117 Ack=9607 Win=262144 Len=1380 [TCP segment of a reassembled PDU];;;;;;;;;;;;;;;;;;;;;;;;;;2,931524;2,931524;0;;0;0;0
80;2,920898;192,168,43,111;204,79,197,200;TCP;1434;58611  >  443 [ACK] Seq=32497 Ack=9607 Win=262144 Len=1380 [TCP segment of a reassembled PDU];;;;;;;;;;;;;;;;;;;;;;;;;;2,931524;2,931524;0;;-0,003715;0,003715;0,00743
81;2,924424;204,79,197,200;192,168,43,111;TCP;54;443  >  58611 [ACK] Seq=9607 Ack=11797 Win=524288 Len=0;;;;;;;;;;;;;;;;;;;;;;;;;;2,931524;2,935239;0,003715;;0,003645;7,00E-05;-0,003575
82;2,924498;192,168,43,111;204,79,197,200;TLSv1,2;1434;Application Data [TCP segment of a reassembled PDU];;;;;;;;;;;;;;;;;;;;;;;;;;2,935239;2,935309;7,00E-05;;0,00007;0;-0,00007
83;2,924498;192,168,43,111;204,79,197,200;TCP;1434;58611  >  443 [ACK] Seq=35257 Ack=9607 Win=262144 Len=1380 [TCP segment of a reassembled PDU];;;;;;;;;;;;;;;;;;;;;;;;;;2,935309;2,935309;0;;-0,081748;0,081748;0,163496
84;2,93144;204,79,197,200;192,168,43,111;TCP;54;443  >  58611 [ACK] Seq=9607 Ack=14557 Win=524288 Len=0;;;;;;;;;;;;;;;;;;;;;;;;;;2,935309;3,017057;0,081748;;0,081748;0;-0,081748
85;2,931524;192,168,43,111;204,79,197,200;TCP;1434;58611  >  443 [ACK] Seq=36637 Ack=9607 Win=262144 Len=1380 [TCP segment of a reassembled PDU];;;;;;;;;;;;;;;;;;;;;;;;;;3,017057;3,017057;0;;0;0;0
86;2,931524;192,168,43,111;204,79,197,200;TCP;1434;58611  >  443 [ACK] Seq=38017 Ack=9607 Win=262144 Len=1380 [TCP segment of a reassembled PDU];;;;;;;;;;;;;;;;;;;;;;;;;;3,017057;3,017057;0;;0;0;0
87;2,931524;192,168,43,111;204,79,197,200;TCP;1434;58611  >  443 [ACK] Seq=39397 Ack=9607 Win=262144 Len=1380 [TCP segment of a reassembled PDU];;;;;;;;;;;;;;;;;;;;;;;;;;3,017057;3,017057;0;;0;0;0
88;2,931524;192,168,43,111;204,79,197,200;TCP;1434;58611  >  443 [ACK] Seq=40777 Ack=9607 Win=262144 Len=1380 [TCP segment of a reassembled PDU];;;;;;;;;;;;;;;;;;;;;;;;;;3,017057;3,017057;0;;0;0;0
89;2,935239;204,79,197,200;192,168,43,111;TCP;54;443  >  58611 [ACK] Seq=9607 Ack=15937 Win=524288 Len=0;;;;;;;;;;;;;;;;;;;;;;;;;;3,017057;3,017057;0;;0;0;0
90;2,935309;192,168,43,111;204,79,197,200;TCP;1434;58611  >  443 [ACK] Seq=42157 Ack=9607 Win=262144 Len=1380 [TCP segment of a reassembled PDU];;;;;;;;;;;;;;;;;;;;;;;;;;3,017057;3,017057;0;;-0,00011;0,00011;0,00022
91;2,935309;192,168,43,111;204,79,197,200;TCP;1434;58611  >  443 [ACK] Seq=43537 Ack=9607 Win=262144 Len=1380 [TCP segment of a reassembled PDU];;;;;;;;;;;;;;;;;;;;;;;;;;3,017057;3,017167;0,00011;;0,000005;0,000105;0,0001
92;3,017057;204,79,197,200;192,168,43,111;TCP;54;443  >  58611 [ACK] Seq=9607 Ack=17317 Win=524288 Len=0;;;;;;;;;;;;;;;;;;;;;;;;;;3,017167;3,017272;0,000105;;0,000105;0;-0,000105
93;3,017057;204,79,197,200;192,168,43,111;TCP;54;443  >  58611 [ACK] Seq=9607 Ack=18697 Win=524288 Len=0;;;;;;;;;;;;;;;;;;;;;;;;;;3,017272;3,017272;0;;0;0;0
94;3,017057;204,79,197,200;192,168,43,111;TCP;54;[TCP Previous segment not captured] 443  >  58610 [ACK] Seq=7782 Ack=486 Win=523776 Len=0;;;;;;;;;;;;;;;;;;;;;;;;;;3,017272;3,017272;0;;0;0;0
95;3,017057;204,79,197,200;192,168,43,111;TCP;54;443  >  58610 [FIN, ACK] Seq=7782 Ack=486 Win=523776 Len=0;;;;;;;;;;;;;;;;;;;;;;;;;;3,017272;3,017272;0;;0;0;0
96;3,017057;204,79,197,200;192,168,43,111;TCP;54;443  >  58611 [ACK] Seq=9607 Ack=20077 Win=524288 Len=0;;;;;;;;;;;;;;;;;;;;;;;;;;3,017272;3,017272;0;;0;0;0
97;3,017057;204,79,197,200;192,168,43,111;TCP;54;443  >  58611 [ACK] Seq=9607 Ack=21457 Win=524288 Len=0;;;;;;;;;;;;;;;;;;;;;;;;;;3,017272;3,017272;0;;0;0;0
98;3,017057;204,79,197,200;192,168,43,111;TCP;54;443  >  58611 [ACK] Seq=9607 Ack=22837 Win=524288 Len=0;;;;;;;;;;;;;;;;;;;;;;;;;;3,017272;3,017272;0;;0;0;0
99;3,017167;192,168,43,111;204,79,197,200;TCP;54;[TCP Dup ACK 43#1] 58610  >  443 [ACK] Seq=486 Ack=7744 Win=261632 Len=0;;;;;;;;;;;;;;;;;;;;;;;;;;3,017272;3,017272;0;;0;0;0
100;3,017272;192,168,43,111;204,79,197,200;TCP;1434;58611  >  443 [ACK] Seq=44917 Ack=9607 Win=262144 Len=1380 [TCP segment of a reassembled PDU];;;;;;;;;;;;;;;;;;;;;;;;;;3,017272;3,017272;0;;0;0;0
101;3,017272;192,168,43,111;204,79,197,200;TCP;1434;58611  >  443 [ACK] Seq=46297 Ack=9607 Win=262144 Len=1380 [TCP segment of a reassembled PDU];;;;;;;;;;;;;;;;;;;;;;;;;;3,017272;3,017272;0;;-0,005581;0,005581;0,011162
102;3,017272;192,168,43,111;204,79,197,200;TCP;1434;58611  >  443 [ACK] Seq=47677 Ack=9607 Win=262144 Len=1380 [TCP segment of a reassembled PDU];;;;;;;;;;;;;;;;;;;;;;;;;;3,017272;3,022853;0,005581;;0,005581;0;-0,005581
103;3,017272;192,168,43,111;204,79,197,200;TCP;1434;58611  >  443 [ACK] Seq=49057 Ack=9607 Win=262144 Len=1380 [TCP segment of a reassembled PDU];;;;;;;;;;;;;;;;;;;;;;;;;;3,022853;3,022853;0;;0;0;0
104;3,017272;192,168,43,111;204,79,197,200;TLSv1,2;1434;Application Data [TCP segment of a reassembled PDU];;;;;;;;;;;;;;;;;;;;;;;;;;3,022853;3,022853;0;;0;0;0
105;3,017272;192,168,43,111;204,79,197,200;TCP;1434;58611  >  443 [ACK] Seq=51817 Ack=9607 Win=262144 Len=1380 [TCP segment of a reassembled PDU];;;;;;;;;;;;;;;;;;;;;;;;;;3,022853;3,022853;0;;0;0;0
106;3,017272;192,168,43,111;204,79,197,200;TCP;1434;58611  >  443 [ACK] Seq=53197 Ack=9607 Win=262144 Len=1380 [TCP segment of a reassembled PDU];;;;;;;;;;;;;;;;;;;;;;;;;;3,022853;3,022853;0;;-0,000097;9,70E-05;0,000194
107;3,017272;192,168,43,111;204,79,197,200;TCP;1434;58611  >  443 [ACK] Seq=54577 Ack=9607 Win=262144 Len=1380 [TCP segment of a reassembled PDU];;;;;;;;;;;;;;;;;;;;;;;;;;3,022853;3,02295;9,70E-05;;0,000097;0;-0,000097
108;3,017272;192,168,43,111;204,79,197,200;TCP;1434;58611  >  443 [ACK] Seq=55957 Ack=9607 Win=262144 Len=1380 [TCP segment of a reassembled PDU];;;;;;;;;;;;;;;;;;;;;;;;;;3,02295;3,02295;0;;-0,000466;0,000466;0,000932
109;3,017272;192,168,43,111;204,79,197,200;TCP;1434;58611  >  443 [ACK] Seq=57337 Ack=9607 Win=262144 Len=1380 [TCP segment of a reassembled PDU];;;;;;;;;;;;;;;;;;;;;;;;;;3,02295;3,023416;0,000466;;0,000466;0;-0,000466
110;3,022853;204,79,197,200;192,168,43,111;TCP;54;443  >  58611 [ACK] Seq=9607 Ack=24217 Win=524288 Len=0;;;;;;;;;;;;;;;;;;;;;;;;;;3,023416;3,023416;0;;0;0;0
111;3,022853;204,79,197,200;192,168,43,111;TCP;54;443  >  58611 [ACK] Seq=9607 Ack=25597 Win=524288 Len=0;;;;;;;;;;;;;;;;;;;;;;;;;;3,023416;3,023416;0;;-0,107074;0,107074;0,214148
112;3,022853;204,79,197,200;192,168,43,111;TCP;54;443  >  58611 [ACK] Seq=9607 Ack=26977 Win=524288 Len=0;;;;;;;;;;;;;;;;;;;;;;;;;;3,023416;3,13049;0,107074;;0,107074;0;-0,107074
113;3,022853;204,79,197,200;192,168,43,111;TCP;54;443  >  58611 [ACK] Seq=9607 Ack=28357 Win=524288 Len=0;;;;;;;;;;;;;;;;;;;;;;;;;;3,13049;3,13049;0;;-0,000137;0,000137;0,000274
114;3,022853;204,79,197,200;192,168,43,111;TCP;54;443  >  58611 [ACK] Seq=9607 Ack=31117 Win=524288 Len=0;;;;;;;;;;;;;;;;;;;;;;;;;;3,13049;3,130627;0,000137;;0,000137;0;-0,000137
115;3,02295;192,168,43,111;204,79,197,200;TCP;1434;58611  >  443 [ACK] Seq=58717 Ack=9607 Win=262144 Len=1380 [TCP segment of a reassembled PDU];;;;;;;;;;;;;;;;;;;;;;;;;;3,130627;3,130627;0;;0;0;0
116;3,02295;192,168,43,111;204,79,197,200;TLSv1,2;274;Application Data, Application Data;;;;;;;;;;;;;;;;;;;;;;;;;;3,130627;3,130627;0;;-0,096447;0,096447;0,192894
117;3,023416;204,79,197,200;192,168,43,111;TCP;54;443  >  58611 [ACK] Seq=9607 Ack=33877 Win=524288 Len=0;;;;;;;;;;;;;;;;;;;;;;;;;;3,130627;3,227074;0,096447;;0,096447;0;-0,096447
118;3,023416;204,79,197,200;192,168,43,111;TCP;54;443  >  58611 [ACK] Seq=9607 Ack=35257 Win=524288 Len=0;;;;;;;;;;;;;;;;;;;;;;;;;;3,227074;3,227074;0;;0;0;0
119;3,023416;204,79,197,200;192,168,43,111;TCP;54;443  >  58611 [ACK] Seq=9607 Ack=38017 Win=524288 Len=0;;;;;;;;;;;;;;;;;;;;;;;;;;3,227074;3,227074;0;;0;0;0
120;3,13049;204,79,197,200;192,168,43,111;TCP;54;443  >  58611 [ACK] Seq=9607 Ack=42157 Win=524288 Len=0;;;;;;;;;;;;;;;;;;;;;;;;;;3,227074;3,227074;0;;-0,093902;0,093902;0,187804
121;3,13049;204,79,197,200;192,168,43,111;TCP;54;443  >  58611 [ACK] Seq=9607 Ack=43537 Win=524288 Len=0;;;;;;;;;;;;;;;;;;;;;;;;;;3,227074;3,320976;0,093902;;0,092432;0,00147;-0,090962
122;3,130627;204,79,197,200;192,168,43,111;TCP;54;443  >  58611 [ACK] Seq=9607 Ack=44917 Win=524288 Len=0;;;;;;;;;;;;;;;;;;;;;;;;;;3,320976;3,322446;0,00147;;0,001387;8,30E-05;-0,001304
123;3,130627;204,79,197,200;192,168,43,111;TCP;54;443  >  58611 [ACK] Seq=9607 Ack=46297 Win=524288 Len=0;;;;;;;;;;;;;;;;;;;;;;;;;;3,322446;3,322529;8,30E-05;;-0,206984;0,207067;0,414051
124;3,130627;204,79,197,200;192,168,43,111;TCP;54;443  >  58611 [ACK] Seq=9607 Ack=47677 Win=524288 Len=0;;;;;;;;;;;;;;;;;;;;;;;;;;3,322529;3,529596;0,207067;;0,206918;0,000149;-0,206769
125;3,227074;204,79,197,200;192,168,43,111;TCP;54;443  >  58611 [ACK] Seq=9607 Ack=49057 Win=524288 Len=0;;;;;;;;;;;;;;;;;;;;;;;;;;3,529596;3,529745;0,000149;;-0,006441;0,00659;0,013031
126;3,227074;204,79,197,200;192,168,43,111;TCP;54;443  >  58611 [ACK] Seq=9607 Ack=50437 Win=524288 Len=0;;;;;;;;;;;;;;;;;;;;;;;;;;3,529745;3,536335;0,00659;;0,006474;0,000116;-0,006358
127;3,227074;204,79,197,200;192,168,43,111;TCP;54;443  >  58611 [ACK] Seq=9607 Ack=51817 Win=524288 Len=0;;;;;;;;;;;;;;;;;;;;;;;;;;3,536335;3,536451;0,000116;;-0,000843;0,000959;0,001802
128;3,227074;204,79,197,200;192,168,43,111;TCP;54;443  >  58611 [ACK] Seq=9607 Ack=53197 Win=524288 Len=0;;;;;;;;;;;;;;;;;;;;;;;;;;3,536451;3,53741;0,000959;;-0,194495;0,195454;0,389949
129;3,320976;192,168,43,111;204,79,197,200;TCP;66;58612  >  443 [SYN] Seq=0 Win=65535 Len=0 MSS=1460 WS=256 SACK_PERM=1;;;;;;;;;;;;;;;;;;;;;;;;;;3,53741;3,732864;0,195454;;0,195454;0;-0,195454
130;3,322446;204,79,197,200;192,168,43,111;TLSv1,2;176;Application Data;;;;;;;;;;;;;;;;;;;;;;;;;;3,732864;3,732864;0;;-0,000121;0,000121;0,000242
131;3,322529;192,168,43,111;204,79,197,200;TCP;54;58611  >  443 [ACK] Seq=60317 Ack=9729 Win=261888 Len=0;;;;;;;;;;;;;;;;;;;;;;;;;;3,732864;3,732985;0,000121;;-0,014637;0,014758;0,029395
132;3,529596;204,79,197,200;192,168,43,111;TCP;66;443  >  58612 [SYN, ACK] Seq=0 Ack=1 Win=65535 Len=0 MSS=1380 WS=256 SACK_PERM=1;;;;;;;;;;;;;;;;;;;;;;;;;;3,732985;3,747743;0,014758;;0,010722;0,004036;-0,006686
133;3,529745;192,168,43,111;204,79,197,200;TCP;54;58612  >  443 [ACK] Seq=1 Ack=1 Win=262144 Len=0;;;;;;;;;;;;;;;;;;;;;;;;;;3,747743;3,751779;0,004036;;0,003682;0,000354;-0,003328
134;3,536335;204,79,197,200;192,168,43,111;TCP;92;[TCP Retransmission] 443  >  58610 [FIN, PSH, ACK] Seq=7744 Ack=486 Win=523776 Len=38;;;;;;;;;;;;;;;;;;;;;;;;;;3,751779;3,752133;0,000354;;-0,000095;0,000449;0,000544
135;3,536451;192,168,43,111;204,79,197,200;TCP;54;58610  >  443 [RST, ACK] Seq=486 Ack=7782 Win=0 Len=0;;;;;;;;;;;;;;;;;;;;;;;;;;3,752133;3,752582;0,000449;;-0,197295;0,197744;0,395039
136;3,53741;192,168,43,111;204,79,197,200;TLSv1,2;547;Client Hello;;;;;;;;;;;;;;;;;;;;;;;;;;3,752582;3,950326;0,197744;;0,197744;0;-0,197744
137;3,732864;204,79,197,200;192,168,43,111;TCP;54;443  >  58612 [ACK] Seq=1 Ack=494 Win=523776 Len=0;;;;;;;;;;;;;;;;;;;;;;;;;;3,950326;3,950326;0;;-0,000124;0,000124;0,000248
138;3,732864;204,79,197,200;192,168,43,111;TLSv1,2;212;Server Hello, Change Cipher Spec, Encrypted Handshake Message;;;;;;;;;;;;;;;;;;;;;;;;;;3,950326;3,95045;0,000124;;-0,000096;0,00022;0,000316
139;3,732985;192,168,43,111;204,79,197,200;TCP;54;58612  >  443 [ACK] Seq=494 Ack=159 Win=261888 Len=0;;;;;;;;;;;;;;;;;;;;;;;;;;3,95045;3,95067;0,00022;;0,000092;0,000128;0,000036
140;3,747743;192,168,43,111;204,79,197,200;TLSv1,2;105;Change Cipher Spec, Encrypted Handshake Message;;;;;;;;;;;;;;;;;;;;;;;;;;3,95067;3,950798;0,000128;;0,000128;0;-0,000128
141;3,751779;192,168,43,111;204,79,197,200;TCP;54;58611  >  443 [FIN, ACK] Seq=60317 Ack=9729 Win=261888 Len=0;;;;;;;;;;;;;;;;;;;;;;;;;;3,950798;3,950798;0;;0;0;0
142;3,752133;192,168,43,111;204,79,197,200;TLSv1,2;141;Application Data;;;;;;;;;;;;;;;;;;;;;;;;;;3,950798;3,950798;0;;0;0;0
143;3,752582;192,168,43,111;204,79,197,200;TLSv1,2;832;Application Data;;;;;;;;;;;;;;;;;;;;;;;;;;3,950798;3,950798;0;;0;0;0
144;3,950326;204,79,197,200;192,168,43,111;TCP;54;443  >  58612 [ACK] Seq=159 Ack=632 Win=523520 Len=0;;;;;;;;;;;;;;;;;;;;;;;;;;3,950798;3,950798;0;;0;0;0
145;3,950326;204,79,197,200;192,168,43,111;TLSv1,2;123;Application Data;;;;;;;;;;;;;;;;;;;;;;;;;;3,950798;3,950798;0;;0;0;0
146;3,95045;192,168,43,111;204,79,197,200;TCP;54;58612  >  443 [ACK] Seq=1410 Ack=228 Win=261888 Len=0;;;;;;;;;;;;;;;;;;;;;;;;;;3,950798;3,950798;0;;0;0;0
147;3,95067;192,168,43,111;204,79,197,200;TLSv1,2;92;Application Data;;;;;;;;;;;;;;;;;;;;;;;;;;3,950798;3,950798;0;;0;0;0
148;3,950798;204,79,197,200;192,168,43,111;TLSv1,2;92;Application Data;;;;;;;;;;;;;;;;;;;;;;;;;;3,950798;3,950798;0;;0;0;0
149;3,950798;204,79,197,200;192,168,43,111;TCP;54;443  >  58611 [ACK] Seq=9729 Ack=60318 Win=524288 Len=0;;;;;;;;;;;;;;;;;;;;;;;;;;3,950798;3,950798;0;;-0,000086;8,60E-05;0,000172
150;3,950798;204,79,197,200;192,168,43,111;TCP;54;443  >  58611 [FIN, ACK] Seq=9729 Ack=60318 Win=524288 Len=0;;;;;;;;;;;;;;;;;;;;;;;;;;3,950798;3,950884;8,60E-05;;-0,000038;0,000124;0,000162
151;3,950798;204,79,197,200;192,168,43,111;TLSv1,2;765;Application Data;;;;;;;;;;;;;;;;;;;;;;;;;;3,950884;3,951008;0,000124;;0,000016;0,000108;0,000092
152;3,950798;204,79,197,200;192,168,43,111;TCP;1434;443  >  58612 [ACK] Seq=977 Ack=1410 Win=524288 Len=1380 [TCP segment of a reassembled PDU];;;;;;;;;;;;;;;;;;;;;;;;;;3,951008;3,951116;0,000108;;0,000108;0;-0,000108
153;3,950798;204,79,197,200;192,168,43,111;TCP;1434;443  >  58612 [ACK] Seq=2357 Ack=1410 Win=524288 Len=1380 [TCP segment of a reassembled PDU];;;;;;;;;;;;;;;;;;;;;;;;;;3,951116;3,951116;0;;-0,000027;2,70E-05;0,000054
154;3,950798;204,79,197,200;192,168,43,111;TLSv1,2;603;Application Data;;;;;;;;;;;;;;;;;;;;;;;;;;3,951116;3,951143;2,70E-05;;-0,00158;0,001607;0,003187
155;3,950798;204,79,197,200;192,168,43,111;TCP;2814;443  >  58612 [ACK] Seq=4286 Ack=1410 Win=524288 Len=2760 [TCP segment of a reassembled PDU];;;;;;;;;;;;;;;;;;;;;;;;;;3,951143;3,95275;0,001607;;0,001532;7,50E-05;-0,001457
156;3,950798;204,79,197,200;192,168,43,111;TLSv1,2;1428;Application Data;;;;;;;;;;;;;;;;;;;;;;;;;;3,95275;3,952825;7,50E-05;;-0,000126;0,000201;0,000327
157;3,950798;204,79,197,200;192,168,43,111;TCP;1434;443  >  58612 [ACK] Seq=8420 Ack=1410 Win=524288 Len=1380 [TCP segment of a reassembled PDU];;;;;;;;;;;;;;;;;;;;;;;;;;3,952825;3,953026;0,000201;;0,000174;2,70E-05;-0,000147
158;3,950884;192,168,43,111;204,79,197,200;TCP;54;58611  >  443 [ACK] Seq=60318 Ack=9730 Win=261888 Len=0;;;;;;;;;;;;;;;;;;;;;;;;;;3,953026;3,953053;2,70E-05;;-0,000784;0,000811;0,001595
159;3,951008;192,168,43,111;204,79,197,200;TCP;54;58612  >  443 [ACK] Seq=1448 Ack=9800 Win=262144 Len=0;;;;;;;;;;;;;;;;;;;;;;;;;;3,953053;3,953864;0,000811;;0,000777;3,40E-05;-0,000743
160;3,951116;204,79,197,200;192,168,43,111;TCP;1434;443  >  58612 [ACK] Seq=9800 Ack=1410 Win=524288 Len=1380 [TCP segment of a reassembled PDU];;;;;;;;;;;;;;;;;;;;;;;;;;3,953864;3,953898;3,40E-05;;-0,097621;0,097655;0,195276
161;3,951116;204,79,197,200;192,168,43,111;TLSv1,2;1428;Application Data;;;;;;;;;;;;;;;;;;;;;;;;;;3,953898;4,051553;0,097655;;0,097655;0;-0,097655
162;3,951143;192,168,43,111;204,79,197,200;TCP;54;58612  >  443 [ACK] Seq=1448 Ack=12554 Win=262144 Len=0;;;;;;;;;;;;;;;;;;;;;;;;;;4,051553;4,051553;0;;0;0;0
163;3,95275;204,79,197,200;192,168,43,111;TCP;2814;443  >  58612 [ACK] Seq=12554 Ack=1410 Win=524288 Len=2760 [TCP segment of a reassembled PDU];;;;;;;;;;;;;;;;;;;;;;;;;;4,051553;4,051553;0;;0;0;0
164;3,952825;192,168,43,111;204,79,197,200;TCP;54;58612  >  443 [ACK] Seq=1448 Ack=15314 Win=262144 Len=0;;;;;;;;;;;;;;;;;;;;;;;;;;4,051553;4,051553;0;;0;0;0
165;3,953026;204,79,197,200;192,168,43,111;TLSv1,2;1428;Application Data;;;;;;;;;;;;;;;;;;;;;;;;;;4,051553;4,051553;0;;0;0;0
166;3,953053;192,168,43,111;204,79,197,200;TCP;54;58612  >  443 [ACK] Seq=1448 Ack=16688 Win=260608 Len=0;;;;;;;;;;;;;;;;;;;;;;;;;;4,051553;4,051553;0;;0;0;0
167;3,953864;204,79,197,200;192,168,43,111;TCP;1434;443  >  58612 [ACK] Seq=16688 Ack=1410 Win=524288 Len=1380 [TCP segment of a reassembled PDU];;;;;;;;;;;;;;;;;;;;;;;;;;4,051553;4,051553;0;;-0,000147;0,000147;0,000294
168;3,953898;192,168,43,111;204,79,197,200;TCP;54;58612  >  443 [ACK] Seq=1448 Ack=18068 Win=262144 Len=0;;;;;;;;;;;;;;;;;;;;;;;;;;4,051553;4,0517;0,000147;;0,000047;1,00E-04;0,000053
169;4,051553;204,79,197,200;192,168,43,111;TCP;1434;443  >  58612 [ACK] Seq=18068 Ack=1410 Win=524288 Len=1380 [TCP segment of a reassembled PDU];;;;;;;;;;;;;;;;;;;;;;;;;;4,0517;4,0518;1,00E-04;;0,000069;3,10E-05;-0,000038
170;4,051553;204,79,197,200;192,168,43,111;TLSv1,2;1428;Application Data;;;;;;;;;;;;;;;;;;;;;;;;;;4,0518;4,051831;3,10E-05;;0,000008;2,30E-05;0,000015
171;4,051553;204,79,197,200;192,168,43,111;TCP;2814;[TCP Previous segment not captured] 443  >  58612 [PSH, ACK] Seq=22202 Ack=1448 Win=524288 Len=2760 [TCP segment of a reassembled PDU] [TCP segment of a reassembled PDU];;;;;;;;;;;;;;;;;;;;;;;;;;4,051831;4,051854;2,30E-05;;-0,000007;3,00E-05;0,000037
172;4,051553;204,79,197,200;192,168,43,111;TLSv1,2;1434;Ignored Unknown Record;;;;;;;;;;;;;;;;;;;;;;;;;;4,051854;4,051884;3,00E-05;;-0,000402;0,000432;0,000834
173;4,051553;204,79,197,200;192,168,43,111;TCP;5574;443  >  58612 [PSH, ACK] Seq=26342 Ack=1448 Win=524288 Len=5520 [TCP segment of a reassembled PDU];;;;;;;;;;;;;;;;;;;;;;;;;;4,051884;4,052316;0,000432;;0,000399;3,30E-05;-0,000366
174;4,051553;204,79,197,200;192,168,43,111;TCP;1434;443  >  58612 [PSH, ACK] Seq=31862 Ack=1448 Win=524288 Len=1380 [TCP segment of a reassembled PDU];;;;;;;;;;;;;;;;;;;;;;;;;;4,052316;4,052349;3,30E-05;;-0,00092;0,000953;0,001873
175;4,051553;204,79,197,200;192,168,43,111;TCP;1434;443  >  58612 [ACK] Seq=33242 Ack=1448 Win=524288 Len=1380 [TCP segment of a reassembled PDU];;;;;;;;;;;;;;;;;;;;;;;;;;4,052349;4,053302;0,000953;;0,000913;4,00E-05;-0,000873
176;4,0517;192,168,43,111;204,79,197,200;TCP;66;58612  >  443 [ACK] Seq=1448 Ack=20822 Win=262144 Len=0 SLE=22202 SRE=24962;;;;;;;;;;;;;;;;;;;;;;;;;;4,053302;4,053342;4,00E-05;;-0,000809;0,000849;0,001658
177;4,0518;192,168,43,111;204,79,197,200;TCP;66;[TCP Dup ACK 176#1] 58612  >  443 [ACK] Seq=1448 Ack=20822 Win=262144 Len=0 SLE=22202 SRE=26342;;;;;;;;;;;;;;;;;;;;;;;;;;4,053342;4,054191;0,000849;;0,000825;2,40E-05;-0,000801
178;4,051831;192,168,43,111;204,79,197,200;TCP;66;[TCP Dup ACK 176#2] 58612  >  443 [ACK] Seq=1448 Ack=20822 Win=262144 Len=0 SLE=22202 SRE=31862;;;;;;;;;;;;;;;;;;;;;;;;;;4,054191;4,054215;2,40E-05;;-0,003049;0,003073;0,006122
179;4,051854;192,168,43,111;204,79,197,200;TCP;66;[TCP Dup ACK 176#3] 58612  >  443 [ACK] Seq=1448 Ack=20822 Win=262144 Len=0 SLE=22202 SRE=33242;;;;;;;;;;;;;;;;;;;;;;;;;;4,054215;4,057288;0,003073;;0,003073;0;-0,003073
180;4,051884;192,168,43,111;204,79,197,200;TCP;66;[TCP Dup ACK 176#4] 58612  >  443 [ACK] Seq=1448 Ack=20822 Win=262144 Len=0 SLE=22202 SRE=34622;;;;;;;;;;;;;;;;;;;;;;;;;;4,057288;4,057288;0;;-0,000097;9,70E-05;0,000194
181;4,052316;204,79,197,200;192,168,43,111;TCP;4194;443  >  58612 [PSH, ACK] Seq=34622 Ack=1448 Win=524288 Len=4140 [TCP segment of a reassembled PDU];;;;;;;;;;;;;;;;;;;;;;;;;;4,057288;4,057385;9,70E-05;;0,00002;7,70E-05;0,000057
182;4,052349;192,168,43,111;204,79,197,200;TCP;66;[TCP Dup ACK 176#5] 58612  >  443 [ACK] Seq=1448 Ack=20822 Win=262144 Len=0 SLE=22202 SRE=38762;;;;;;;;;;;;;;;;;;;;;;;;;;4,057385;4,057462;7,70E-05;;-0,000504;0,000581;0,001085
183;4,053302;204,79,197,200;192,168,43,111;TCP;2814;443  >  58612 [PSH, ACK] Seq=38762 Ack=1448 Win=524288 Len=2760 [TCP segment of a reassembled PDU];;;;;;;;;;;;;;;;;;;;;;;;;;4,057462;4,058043;0,000581;;0,000581;0;-0,000581
184;4,053342;192,168,43,111;204,79,197,200;TCP;66;[TCP Dup ACK 176#6] 58612  >  443 [ACK] Seq=1448 Ack=20822 Win=262144 Len=0 SLE=22202 SRE=41522;;;;;;;;;;;;;;;;;;;;;;;;;;4,058043;4,058043;0;;-0,000031;3,10E-05;0,000062
185;4,054191;204,79,197,200;192,168,43,111;TCP;1434;443  >  58612 [ACK] Seq=41522 Ack=1448 Win=524288 Len=1380 [TCP segment of a reassembled PDU];;;;;;;;;;;;;;;;;;;;;;;;;;4,058043;4,058074;3,10E-05;;-0,000003;3,40E-05;0,000037
186;4,054215;192,168,43,111;204,79,197,200;TCP;66;[TCP Dup ACK 176#7] 58612  >  443 [ACK] Seq=1448 Ack=20822 Win=262144 Len=0 SLE=22202 SRE=42902;;;;;;;;;;;;;;;;;;;;;;;;;;4,058074;4,058108;3,40E-05;;-0,103554;0,103588;0,207142
187;4,057288;204,79,197,200;192,168,43,111;TCP;1434;443  >  58612 [ACK] Seq=42902 Ack=1448 Win=524288 Len=1380 [TCP segment of a reassembled PDU];;;;;;;;;;;;;;;;;;;;;;;;;;4,058108;4,161696;0,103588;;0,103506;8,20E-05;-0,103424
188;4,057288;204,79,197,200;192,168,43,111;TCP;1434;[TCP Previous segment not captured] 443  >  58612 [ACK] Seq=45662 Ack=1448 Win=524288 Len=1380 [TCP segment of a reassembled PDU];;;;;;;;;;;;;;;;;;;;;;;;;;4,161696;4,161778;8,20E-05;;-0,000212;0,000294;0,000506
189;4,057385;192,168,43,111;204,79,197,200;TCP;66;[TCP Dup ACK 176#8] 58612  >  443 [ACK] Seq=1448 Ack=20822 Win=262144 Len=0 SLE=22202 SRE=44282;;;;;;;;;;;;;;;;;;;;;;;;;;4,161778;4,162072;0,000294;;0,00027;2,40E-05;-0,000246
190;4,057462;192,168,43,111;204,79,197,200;TCP;74;[TCP Dup ACK 176#9] 58612  >  443 [ACK] Seq=1448 Ack=20822 Win=262144 Len=0 SLE=45662 SRE=47042 SLE=22202 SRE=44282;;;;;;;;;;;;;;;;;;;;;;;;;;4,162072;4,162096;2,40E-05;;-0,001115;0,001139;0,002254
191;4,058043;204,79,197,200;192,168,43,111;TCP;1434;[TCP Previous segment not captured] 443  >  58612 [ACK] Seq=49802 Ack=1448 Win=524288 Len=1380 [TCP segment of a reassembled PDU];;;;;;;;;;;;;;;;;;;;;;;;;;4,162096;4,163235;0,001139;;0,001098;4,10E-05;-0,001057
192;4,058043;204,79,197,200;192,168,43,111;TCP;1434;[TCP Previous segment not captured] 443  >  58612 [PSH, ACK] Seq=56702 Ack=1448 Win=524288 Len=1380 [TCP segment of a reassembled PDU];;;;;;;;;;;;;;;;;;;;;;;;;;4,163235;4,163276;4,10E-05;;-0,002484;0,002525;0,005009
193;4,058074;192,168,43,111;204,79,197,200;TCP;82;[TCP Dup ACK 176#10] 58612  >  443 [ACK] Seq=1448 Ack=20822 Win=262144 Len=0 SLE=49802 SRE=51182 SLE=45662 SRE=47042 SLE=22202 SRE=44282;;;;;;;;;;;;;;;;;;;;;;;;;;4,163276;4,165801;0,002525;;0,002525;0;-0,002525
194;4,058108;192,168,43,111;204,79,197,200;TCP;90;[TCP Dup ACK 176#11] 58612  >  443 [ACK] Seq=1448 Ack=20822 Win=262144 Len=0 SLE=56702 SRE=58082 SLE=49802 SRE=51182 SLE=45662 SRE=47042 SLE=22202 SRE=44282;;;;;;;;;;;;;;;;;;;;;;;;;;4,165801;4,165801;0;;-0,000084;8,40E-05;0,000168
195;4,161696;204,79,197,200;192,168,43,111;TCP;1434;443  >  58612 [ACK] Seq=58082 Ack=1448 Win=524288 Len=1380 [TCP segment of a reassembled PDU], Ignored Unknown Record;;;;;;;;;;;;;;;;;;;;;;;;;;4,165801;4,165885;8,40E-05;;-0,000021;0,000105;0,000126
196;4,161778;192,168,43,111;204,79,197,200;TCP;90;[TCP Dup ACK 176#12] 58612  >  443 [ACK] Seq=1448 Ack=20822 Win=262144 Len=0 SLE=56702 SRE=59462 SLE=49802 SRE=51182 SLE=45662 SRE=47042 SLE=22202 SRE=44282;;;;;;;;;;;;;;;;;;;;;;;;;;4,165885;4,16599;0,000105;;-0,00075;0,000855;0,001605
197;4,162072;204,79,197,200;192,168,43,111;TLSv1,2;1434;Ignored Unknown Record;;;;;;;;;;;;;;;;;;;;;;;;;;4,16599;4,166845;0,000855;;0,000807;4,80E-05;-0,000759
198;4,162096;192,168,43,111;204,79,197,200;TCP;90;[TCP Dup ACK 176#13] 58612  >  443 [ACK] Seq=1448 Ack=20822 Win=262144 Len=0 SLE=56702 SRE=60842 SLE=49802 SRE=51182 SLE=45662 SRE=47042 SLE=22202 SRE=44282;;;;;;;;;;;;;;;;;;;;;;;;;;4,166845;4,166893;4,80E-05;;-0,000637;0,000685;0,001322
199;4,163235;204,79,197,200;192,168,43,111;TLSv1,2;1434;Ignored Unknown Record;;;;;;;;;;;;;;;;;;;;;;;;;;4,166893;4,167578;0,000685;;0,000651;3,40E-05;-0,000617
200;4,163276;192,168,43,111;204,79,197,200;TCP;90;[TCP Dup ACK 176#14] 58612  >  443 [ACK] Seq=1448 Ack=20822 Win=262144 Len=0 SLE=56702 SRE=62222 SLE=49802 SRE=51182 SLE=45662 SRE=47042 SLE=22202 SRE=44282;;;;;;;;;;;;;;;;;;;;;;;;;;4,167578;4,167612;3,40E-05;;-0,000968;0,001002;0,00197
201;4,165801;204,79,197,200;192,168,43,111;TLSv1,2;1434;Ignored Unknown Record;;;;;;;;;;;;;;;;;;;;;;;;;;4,167612;4,168614;0,001002;;0,000946;5,60E-05;-0,00089
202;4,165801;204,79,197,200;192,168,43,111;TCP;1434;[TCP Fast Retransmission] 443  >  58612 [ACK] Seq=20822 Ack=1448 Win=524288 Len=1380 [TCP segment of a reassembled PDU];;;;;;;;;;;;;;;;;;;;;;;;;;4,168614;4,16867;5,60E-05;;-0,059635;0,059691;0,119326
203;4,165885;192,168,43,111;204,79,197,200;TCP;90;[TCP Dup ACK 176#15] 58612  >  443 [ACK] Seq=1448 Ack=20822 Win=262144 Len=0 SLE=56702 SRE=63602 SLE=49802 SRE=51182 SLE=45662 SRE=47042 SLE=22202 SRE=44282;;;;;;;;;;;;;;;;;;;;;;;;;;4,16867;4,228361;0,059691;;0,059691;0;-0,059691
